{
  "feature": "Example feature",
  "stage": "implement",
  "status": "active",
  "current_ticket": "TICKET-002",
  "completed_tickets": ["TICKET-001"],
  "failed_attempts": [],
  "last_verified_commit": null,
  "next_action": "Write the first failing behavioral test for TICKET-002",
  "blockers": [],
  "activated_skills": ["sdlc-orchestrator", "tdd"]
}
